{
  "$schema": "https://json-schema.org/draft/2020-12/schema",
  "$id": "xinsight://sources/openinference/otlp-span/v1",
  "title": "X-Insight sanitized OpenInference LLM span V1",
  "type": "object",
  "additionalProperties": false,
  "required": [
    "schema_version",
    "trace_id",
    "span_id",
    "span_name",
    "span_kind",
    "start_time",
    "end_time",
    "status",
    "model",
    "missing_parent"
  ],
  "properties": {
    "schema_version": { "const": "xinsight.otlp-openinference-span.v1" },
    "trace_id": { "type": "string", "pattern": "^[0-9a-f]{32}$" },
    "span_id": { "type": "string", "pattern": "^[0-9a-f]{16}$" },
    "parent_span_id": { "type": "string", "pattern": "^[0-9a-f]{16}$" },
    "session_id": { "type": "string", "minLength": 1, "maxLength": 256 },
    "span_name": { "type": "string", "minLength": 1, "maxLength": 240 },
    "span_kind": { "const": "LLM" },
    "start_time": {
      "type": "string",
      "pattern": "^[0-9]{4}-[0-9]{2}-[0-9]{2}T[0-9]{2}:[0-9]{2}:[0-9]{2}\\.[0-9]{6}Z$"
    },
    "end_time": {
      "type": "string",
      "pattern": "^[0-9]{4}-[0-9]{2}-[0-9]{2}T[0-9]{2}:[0-9]{2}:[0-9]{2}\\.[0-9]{6}Z$"
    },
    "status": { "enum": ["succeeded", "failed"] },
    "model": { "type": "string", "minLength": 1, "maxLength": 240 },
    "provider": { "type": "string", "minLength": 1, "maxLength": 160 },
    "prompt_tokens": { "$ref": "#/$defs/nonnegativeInt64" },
    "completion_tokens": { "$ref": "#/$defs/nonnegativeInt64" },
    "total_tokens": { "$ref": "#/$defs/nonnegativeInt64" },
    "actor_ref": { "type": "string", "minLength": 1, "maxLength": 256 },
    "service_name": { "type": "string", "minLength": 1, "maxLength": 240 },
    "missing_parent": { "type": "boolean" }
  },
  "$defs": {
    "nonnegativeInt64": {
      "type": "string",
      "pattern": "^(0|[1-9][0-9]{0,17}|[1-8][0-9]{18}|9[01][0-9]{17}|92[01][0-9]{16}|922[0-2][0-9]{15}|9223[0-2][0-9]{14}|92233[0-6][0-9]{13}|922337[01][0-9]{12}|92233720[0-2][0-9]{10}|922337203[0-5][0-9]{9}|9223372036[0-7][0-9]{8}|92233720368[0-4][0-9]{7}|922337203685[0-3][0-9]{6}|9223372036854[0-6][0-9]{5}|92233720368547[0-6][0-9]{4}|922337203685477[0-4][0-9]{3}|9223372036854775[0-7][0-9]{2}|922337203685477580[0-7])$",
      "maxLength": 19
    }
  }
}
